{
  "id": "01KA4VHABZ0J1MM84N5MNTKS43",
  "slug": "analoge-fotografie-kostenubersicht",
  "path": "vault/2025-11/analoge-fotografie-kostenubersicht--01KA4VHABZ0J1MM84N5MNTKS43.md",
  "title": "Analoge Fotografie – Kostenübersicht",
  "tags": [],
  "aliases": [],
  "categories": [],
  "language": "de",
  "created": "2025-11-15T00:00:00",
  "updated": "2025-11-15T22:52:51.967654Z",
  "full_text": "# Film\n- 30,5 m Bulk-Rolle ~ 42 €\n- ~18–20 Filme bei 36 Aufnahmen = ca. 2 € pro Film\n- Chemie (Entwickler, Fixierer) pro Film grob überschlagen\n\n# Dunkelkammer\n- Papier (Ilford) als größter laufender Posten\n- Stromkosten Vergrößerer + Wasser\n\n# Fazit\n- Deutlich günstiger als einzelne Kleinpackungen,\n  aber Zeitaufwand bleibt der eigentliche „Kostenfaktor“.",
  "links": [],
  "backlinks": [],
  "content_hash": "sha256:902033786c8e312c796bec880f302e6ef2751e95bc555763d4ff3804bdd36940",
  "file_hash": "sha256:4e4a7c6904954a78e06309cc7416e12f84e7ba027cebbdd6a490c91af75dd92a",
  "status": {
    "relevance_score": 1.0,
    "archived": false
  },
  "embedding_meta": {
    "text": {
      "model": "jina/jina-embeddings-v2-base-de:latest",
      "dim": 768,
      "updated_at": "2025-11-15T23:54:35.651132Z",
      "chunk_hashes": [
        "e4bdec86c130",
        "b9ba4f28400b",
        "19999f8ac00e"
      ]
    }
  },
  "facets": {},
  "doc_type": "note"
}