{
  "id": "01KA4VHA6M9P0EKQGQ3KQHVAMV",
  "slug": "markdown-standards",
  "path": "vault/2025-10/markdown-standards--01KA4VHA6M9P0EKQGQ3KQHVAMV.md",
  "title": "Markdown Standards",
  "tags": [
    "test",
    "documentation"
  ],
  "aliases": [],
  "categories": [],
  "language": "en",
  "created": "2025-10-22T00:00:00",
  "updated": "2025-11-15T22:52:51.799655Z",
  "full_text": "# Markdown Standards\n\nMarkdown documentation standards.\n\nThis is a test file for documentation purposes.",
  "links": [],
  "backlinks": [],
  "content_hash": "sha256:3613959eb250d2f8335268876cdd9dba03238afdc0ea1f69809f413c90a8b1b9",
  "file_hash": "sha256:7271d0a5f106b6be36e4bf6b5dad7a5834b031c55b6463615c3d07316d670c73",
  "status": {
    "relevance_score": 1.0,
    "archived": false
  },
  "facets": {},
  "doc_type": "note"
}