{
  "id": "01KA4VHA21TAXFPY59SWC11QYA",
  "slug": "chicken-coop-automation",
  "path": "vault/2025-10/chicken-coop-automation--01KA4VHA21TAXFPY59SWC11QYA.md",
  "title": "Chicken Coop Automation",
  "tags": [
    "test",
    "hobby"
  ],
  "aliases": [],
  "categories": [],
  "language": "en",
  "created": "2025-10-31T00:00:00",
  "updated": "2025-11-15T22:52:51.652657Z",
  "full_text": "# Chicken Coop Automation\n\nAutomating chicken coop operations.\n\nThis is a test file for documentation purposes.",
  "links": [],
  "backlinks": [],
  "content_hash": "sha256:2d9aea2f7c3d43913c1448bfb33fcafdef2d2e2914c6633ddeac0a5f8daf8570",
  "file_hash": "sha256:f987e8ae1397bfeed759b541e16dc853fc2fdb21f874e6111aee58fbfb1f7aaf",
  "status": {
    "relevance_score": 1.0,
    "archived": false
  },
  "facets": {},
  "doc_type": "note"
}