{
  "id": "01KA4VH9QXPMVKM1YN30K7S9A1",
  "slug": "bewerbung-ux-designer",
  "path": "vault/2025-11/bewerbung-ux-designer--01KA4VH9QXPMVKM1YN30K7S9A1.md",
  "title": "Bewerbung UX Designer",
  "tags": [
    "test",
    "bewerbungen"
  ],
  "aliases": [],
  "categories": [],
  "language": "en",
  "created": "2025-11-03T00:00:00",
  "updated": "2025-11-15T22:52:51.329659Z",
  "full_text": "# Bewerbung UX Designer\n\nDesign Position.\n\nThis is a test file for documentation purposes.",
  "links": [],
  "backlinks": [],
  "content_hash": "sha256:e63a930b6d9f93a791d65c8f693002fd629ece9c114a3549fe63ad7ea53bab5d",
  "file_hash": "sha256:43f973d77126658cde46a5e37da67db0974f2f0fe153c483b6e00fe23e28ac06",
  "status": {
    "relevance_score": 1.0,
    "archived": false
  },
  "facets": {},
  "doc_type": "note"
}